{
  "bankId": "bank-gamma",
  "name": "Gamma Digital Bank",
  "legalName": "Gamma Digital Bank GmbH",
  "status": "active",
  "countryOfOwnerResidence": "Germany",
  "headquartersCountry": "Germany",
  "jurisdiction": "BaFin (German Federal Financial Supervisory Authority)",
  "overview": {
    "type": "digital bank",
    "segment": "Digital Banking",
    "foundedYear": 2015,
    "description": "Modern digital-first bank with cutting-edge technology, zero fees, and 24/7 customer support. Built for the digital age since 2015.",
    "logoUrl": "/images/banks/gamma-logo.png",
    "iconUrl": "/images/banks/gamma-icon.svg"
  },
  "systems": {
    "cardSystems": ["visa", "mastercard", "maestro"],
    "swiftAvailable": true,
    "ibanSupported": true,
    "sepaAvailable": true,
    "localClearing": true,
    "instantTransfers": true,
    "cryptoExposure": "moderate"
  },
  "currencies": {
    "available": ["USD", "EUR", "GBP", "CHF", "JPY", "AUD", "CAD", "CNY"],
    "baseCurrency": "EUR",
    "multiCurrencyAccounts": true,
    "fxMarkupPercent": 0.0
  },
  "fees": {
    "commissions": {
      "incomingDomesticPercent": 0.0,
      "incomingInternationalPercent": 0.0,
      "outgoingDomesticPercent": 0.0,
      "outgoingInternationalPercent": 0.05,
      "cashWithdrawalLocalAtmPercent": 0.0,
      "cashWithdrawalInternationalAtmPercent": 0.0,
      "fxMarkupPercent": 0.0
    },
    "accountFees": {
      "accountOpening": 0.0,
      "monthlyMaintenance": 0.0,
      "accountClosure": 0.0,
      "dormancyAfterMonths": 36,
      "dormancyFee": 0.0
    },
    "cardFees": {
      "cardIssuance": 0.0,
      "premiumCardAnnualFee": 0.0,
      "replacementCardFee": 5.0
    },
    "transferFees": {
      "swiftPaymentProcessing": 5.0,
      "urgentPaymentSurcharge": 0.0,
      "chargebackHandling": 0.0
    }
  },
  "branches": {
    "count": 0,
    "countries": ["Germany"],
    "atmCount": 0,
    "partnerAtmNetwork": 50000
  },
  "transactions": {
    "outgoingDestinations": [
      { "country": "France" },
      { "country": "Netherlands" },
      { "country": "Austria" },
      { "country": "Poland" }
    ]
  },
  "clients": {
    "total": 2000000,
    "retail": 1900000,
    "business": 95000,
    "corporate": 5000,
    "privateBanking": 0
  },
  "ratings": {
    "overall": 4.7,
    "history": [],
    "source": "internal",
    "lastUpdated": "2026-04-10T00:00:00Z"
  },
  "compliance": {
    "sanctionsRisk": "low",
    "governmentAffiliate": false,
    "pepExposure": "low",
    "offshoreLinks": "none",
    "amlStatus": "good",
    "kycStatus": "complete",
    "fATCA": true,
    "crs": true,
    "auditPublished": true,
    "depositInsurance": true
  },
  "digitalChannels": {
    "mobileApp": true,
    "webBanking": true,
    "ios": true,
    "android": true,
    "apiAccess": true,
    "biometricLogin": true,
    "deviceTrust": true,
    "pushNotifications": true,
    "uptimePercent": 99.99,
    "averageAccountOpeningMinutes": 5
  },
  "support": {
    "available24x7": true,
    "channels": ["chat", "email", "app", "web"],
    "averageResponseTimeMinutes": 2,
    "languages": ["English", "German", "French", "Spanish", "Italian"]
  },
  "products": {
    "accounts": true,
    "cards": true,
    "savings": true,
    "loans": false,
    "mortgages": false,
    "investmentTools": true,
    "merchantAcquiring": false,
    "payroll": false,
    "escrow": false,
    "tradeFinance": false
  },
  "redFlags": [],
  "metrics": {
    "clientSatisfactionPercent": 94.0,
    "corporateSatisfactionPercent": 89.0,
    "complaintRatioPercent": 0.2,
    "avgRemediationDays": 2,
    "openIssues": 5,
    "resolvedEvents": 234
  },
  "metadata": {
    "createdAt": "2026-01-01T00:00:00Z",
    "updatedAt": "2026-04-10T00:00:00Z",
    "lastReviewed": "2026-04-09T16:45:00Z",
    "source": "internal",
    "confidence": 0.98
  },
  "theme": {
    "accentColor": "#00e676"
  },
  "animationConfig": {
    "gradientStops": [
      { "offset": "0%", "color": "#6a1b9a" },
      { "offset": "100%", "color": "#9c27b0" }
    ],
    "balls": [
      { "centerX": 100, "centerY": 250, "radius": 140, "color": "#00e676" },
      { "centerX": 450, "centerY": 300, "radius": 160, "color": "#9c27b0" },
      { "centerX": 300, "centerY": 100, "radius": 100, "color": "#00e676" }
    ],
    "animationType": "float"
  },
  "defaultLanguage": "de-DE",
  "websiteUrl": "https://www.gammadigital.com",
  "contactInfo": {
    "phone": "+1-877-GAMMA-DIG",
    "email": "hello@gammadigital.com",
    "address": "789 Innovation Way, San Francisco, CA 94105, USA"
  }
}
