{
  "bankId": "bank-alpha",
  "name": "Alpha Global Bank",
  "legalName": "Alpha Global Bank Ltd.",
  "status": "active",
  "countryOfOwnerResidence": "United Kingdom",
  "headquartersCountry": "United Kingdom",
  "jurisdiction": "UK Financial Conduct Authority",
  "overview": {
    "type": "retail bank",
    "segment": "Universal Banking",
    "foundedYear": 1985,
    "description": "Leading financial institution with comprehensive banking solutions and award-winning customer service. Established in 1985, serving millions of customers worldwide.",
    "logoUrl": "/images/banks/alpha-logo.png",
    "iconUrl": "/images/banks/alpha-icon.svg"
  },
  "systems": {
    "cardSystems": ["visa", "mastercard", "amex"],
    "swiftAvailable": true,
    "ibanSupported": true,
    "sepaAvailable": true,
    "localClearing": true,
    "instantTransfers": true,
    "cryptoExposure": "none"
  },
  "currencies": {
    "available": ["USD", "EUR", "GBP", "CHF", "JPY", "AUD", "CAD"],
    "baseCurrency": "GBP",
    "multiCurrencyAccounts": true,
    "fxMarkupPercent": 0.5
  },
  "fees": {
    "commissions": {
      "incomingDomesticPercent": 0.0,
      "incomingInternationalPercent": 0.15,
      "outgoingDomesticPercent": 0.15,
      "outgoingInternationalPercent": 0.25,
      "cashWithdrawalLocalAtmPercent": 0.0,
      "cashWithdrawalInternationalAtmPercent": 2.5,
      "fxMarkupPercent": 0.5
    },
    "accountFees": {
      "accountOpening": 0.0,
      "monthlyMaintenance": 5.0,
      "accountClosure": 0.0,
      "dormancyAfterMonths": 12,
      "dormancyFee": 10.0
    },
    "cardFees": {
      "cardIssuance": 10.0,
      "premiumCardAnnualFee": 12.0,
      "replacementCardFee": 15.0
    },
    "transferFees": {
      "swiftPaymentProcessing": 25.0,
      "urgentPaymentSurcharge": 15.0,
      "chargebackHandling": 25.0
    }
  },
  "branches": {
    "count": 250,
    "countries": ["United Kingdom", "Ireland", "Isle of Man"],
    "atmCount": 500,
    "partnerAtmNetwork": 5000
  },
  "transactions": {
    "outgoingDestinations": [
      { "country": "Ireland" },
      { "country": "Germany" },
      { "country": "France" },
      { "country": "United States" }
    ]
  },
  "clients": {
    "total": 5000000,
    "retail": 4200000,
    "business": 650000,
    "corporate": 120000,
    "privateBanking": 30000
  },
  "ratings": {
    "overall": 4.5,
    "history": [],
    "source": "internal",
    "lastUpdated": "2026-04-10T00:00:00Z"
  },
  "compliance": {
    "sanctionsRisk": "low",
    "governmentAffiliate": false,
    "pepExposure": "low",
    "offshoreLinks": "limited",
    "amlStatus": "good",
    "kycStatus": "complete",
    "fATCA": true,
    "crs": true,
    "auditPublished": true,
    "depositInsurance": true
  },
  "digitalChannels": {
    "mobileApp": true,
    "webBanking": true,
    "ios": true,
    "android": true,
    "apiAccess": true,
    "biometricLogin": true,
    "deviceTrust": true,
    "pushNotifications": true,
    "uptimePercent": 99.9,
    "averageAccountOpeningMinutes": 15
  },
  "support": {
    "available24x7": true,
    "channels": ["phone", "email", "chat", "app", "web"],
    "averageResponseTimeMinutes": 5,
    "languages": ["English", "French", "Spanish", "German"]
  },
  "products": {
    "accounts": true,
    "cards": true,
    "savings": true,
    "loans": true,
    "mortgages": true,
    "investmentTools": true,
    "merchantAcquiring": true,
    "payroll": true,
    "escrow": true,
    "tradeFinance": false
  },
  "redFlags": [],
  "metrics": {
    "clientSatisfactionPercent": 87.5,
    "corporateSatisfactionPercent": 92.0,
    "complaintRatioPercent": 0.8,
    "avgRemediationDays": 7,
    "openIssues": 12,
    "resolvedEvents": 145
  },
  "metadata": {
    "createdAt": "2026-01-01T00:00:00Z",
    "updatedAt": "2026-04-10T00:00:00Z",
    "lastReviewed": "2026-04-08T14:30:00Z",
    "source": "internal",
    "confidence": 0.95
  },
  "theme": {
    "accentColor": "#ff6f00"
  },
  "animationConfig": {
    "gradientStops": [
      { "offset": "0%", "color": "#1a237e" },
      { "offset": "100%", "color": "#3949ab" }
    ],
    "balls": [
      { "centerX": 150, "centerY": 150, "radius": 120, "color": "#ff6f00" },
      { "centerX": 550, "centerY": 400, "radius": 180, "color": "#3949ab" }
    ],
    "animationType": "wave"
  },
  "defaultLanguage": "en-GB",
  "websiteUrl": "https://www.alphaglobal.com",
  "contactInfo": {
    "phone": "+1-800-ALPHA-BANK",
    "email": "info@alphaglobal.com",
    "address": "123 Financial District, New York, NY 10004, USA"
  }
}
