{
  "bankId": "bank-epsilon",
  "name": "Epsilon International Bank",
  "legalName": "Epsilon International Bank SA",
  "status": "active",
  "countryOfOwnerResidence": "Spain",
  "headquartersCountry": "Spain",
  "jurisdiction": "Banco de España",
  "overview": {
    "type": "private bank",
    "segment": "Private Banking & Wealth Management",
    "foundedYear": 1950,
    "description": "Global banking powerhouse with presence in 50+ countries. Premium banking services for high-net-worth individuals and corporations since 1950.",
    "logoUrl": "/images/banks/epsilon-logo.png",
    "iconUrl": "/images/banks/epsilon-icon.svg"
  },
  "systems": {
    "cardSystems": ["visa", "mastercard", "amex", "unionpay"],
    "swiftAvailable": true,
    "ibanSupported": true,
    "sepaAvailable": true,
    "localClearing": true,
    "instantTransfers": true,
    "cryptoExposure": "low"
  },
  "currencies": {
    "available": ["USD", "EUR", "GBP", "CHF", "JPY", "AUD", "CAD", "CNY", "SGD", "HKD", "AED", "SEK"],
    "baseCurrency": "EUR",
    "multiCurrencyAccounts": true,
    "fxMarkupPercent": 0.3
  },
  "fees": {
    "commissions": {
      "incomingDomesticPercent": 0.0,
      "incomingInternationalPercent": 0.1,
      "outgoingDomesticPercent": 0.0,
      "outgoingInternationalPercent": 0.15,
      "cashWithdrawalLocalAtmPercent": 0.0,
      "cashWithdrawalInternationalAtmPercent": 0.0,
      "fxMarkupPercent": 0.3
    },
    "accountFees": {
      "accountOpening": 0.0,
      "monthlyMaintenance": 0.0,
      "accountClosure": 0.0,
      "dormancyAfterMonths": 60,
      "dormancyFee": 0.0
    },
    "cardFees": {
      "cardIssuance": 25.0,
      "premiumCardAnnualFee": 50.0,
      "replacementCardFee": 20.0
    },
    "transferFees": {
      "swiftPaymentProcessing": 15.0,
      "urgentPaymentSurcharge": 5.0,
      "chargebackHandling": 20.0
    }
  },
  "branches": {
    "count": 850,
    "countries": ["Spain", "United Kingdom", "France", "Germany", "Switzerland", "United States", "Singapore", "Hong Kong", "UAE"],
    "atmCount": 2500,
    "partnerAtmNetwork": 100000
  },
  "transactions": {
    "outgoingDestinations": [
      { "country": "United Kingdom" },
      { "country": "France" },
      { "country": "Germany" },
      { "country": "Switzerland" },
      { "country": "United States" },
      { "country": "Singapore" },
      { "country": "Hong Kong" },
      { "country": "UAE" }
    ]
  },
  "clients": {
    "total": 15000000,
    "retail": 10000000,
    "business": 3000000,
    "corporate": 1500000,
    "privateBanking": 500000
  },
  "ratings": {
    "overall": 4.6,
    "history": [],
    "source": "internal",
    "lastUpdated": "2026-04-10T00:00:00Z"
  },
  "compliance": {
    "sanctionsRisk": "low",
    "governmentAffiliate": false,
    "pepExposure": "moderate",
    "offshoreLinks": "limited",
    "amlStatus": "good",
    "kycStatus": "complete",
    "fATCA": true,
    "crs": true,
    "auditPublished": true,
    "depositInsurance": true
  },
  "digitalChannels": {
    "mobileApp": true,
    "webBanking": true,
    "ios": true,
    "android": true,
    "apiAccess": true,
    "biometricLogin": true,
    "deviceTrust": true,
    "pushNotifications": true,
    "uptimePercent": 99.95,
    "averageAccountOpeningMinutes": 10
  },
  "support": {
    "available24x7": true,
    "channels": ["phone", "email", "chat", "branch", "app", "web"],
    "averageResponseTimeMinutes": 3,
    "languages": ["English", "Spanish", "French", "German", "Mandarin", "Japanese", "Arabic"]
  },
  "products": {
    "accounts": true,
    "cards": true,
    "savings": true,
    "loans": true,
    "mortgages": true,
    "investmentTools": true,
    "merchantAcquiring": true,
    "payroll": true,
    "escrow": true,
    "tradeFinance": true
  },
  "redFlags": [],
  "metrics": {
    "clientSatisfactionPercent": 93.0,
    "corporateSatisfactionPercent": 95.0,
    "complaintRatioPercent": 0.3,
    "avgRemediationDays": 3,
    "openIssues": 8,
    "resolvedEvents": 412
  },
  "metadata": {
    "createdAt": "2026-01-01T00:00:00Z",
    "updatedAt": "2026-04-10T00:00:00Z",
    "lastReviewed": "2026-04-10T08:20:00Z",
    "source": "internal",
    "confidence": 0.96
  },
  "theme": {
    "accentColor": "#ffd600"
  },
  "animationConfig": {
    "gradientStops": [
      { "offset": "0%", "color": "#004d40" },
      { "offset": "100%", "color": "#00695c" }
    ],
    "balls": [
      { "centerX": 180, "centerY": 180, "radius": 140, "color": "#ffd600" },
      { "centerX": 420, "centerY": 320, "radius": 170, "color": "#00695c" },
      { "centerX": 320, "centerY": 450, "radius": 110, "color": "#ffd600" }
    ],
    "animationType": "wave"
  },
  "defaultLanguage": "es-ES",
  "websiteUrl": "https://www.epsiloninternational.com",
  "contactInfo": {
    "phone": "+34-900-EPSILON",
    "email": "contact@epsiloninternational.com",
    "address": "Gran Vía 28, Madrid 28013, Spain"
  }
}
